,Review
825,The service here is fair at best.
826,"I do love sushi, but I found Kabuki to be over-priced, over-hip and under-services."
827,Do yourself a favor and stay away from this dish.
828,Very poor service.
829,No one at the table thought the food was above average or worth the wait that we had for it.
830,"Best service and food ever, Maria our server was so good and friendly she made our day."
831,They were excellent.
832,I paid the bill but did not tip because I felt the server did a terrible job.
833,Just had lunch here and had a great experience.
834,I have never had such bland food which surprised me considering the article we read focused so much on their spices and flavor.
835,Food is way overpriced and portions are fucking small.
836,I recently tried Caballero's and I have been back every week since!
837,"for 40 bucks a head, i really expect better food."
838,The food came out at a good pace.
839,"I ate there twice on my last visit, and especially enjoyed the salmon salad."
840,We could not believe how dirty the oysters were!
841,This place deserves no stars.
842,"In fact I'm going to round up to 4 stars, just because she was so awesome."
843,"To my disbelief, each dish qualified as the worst version of these foods I have ever tasted."
844,"Bad day or not, I have a very low tolerance for rude customer service people, it is your job to be nice and polite, wash dishes otherwise!!"
845,the potatoes were great and so was the biscuit.
846,I probably would not go here again.
847,So flavorful and has just the perfect amount of heat.
848,The price is reasonable and the service is great.
849,"The Wife hated her meal (coconut shrimp), and our friends really did not enjoy their meals, either."
850,My fella got the huevos rancheros and they didn't look too appealing.
851,"Went in for happy hour, great list of wines."
852,Some may say this buffet is pricey but I think you get what you pay for and this place you are getting quite a lot!
853,I probably won't be coming back here.
854,Worst food/service I've had in a while.
855,"This place is pretty good, nice little vibe in the restaurant."
856,Talk about great customer service of course we will be back.
857,"Hot dishes are not hot, cold dishes are close to room temp.I watched staff prepare food with BARE HANDS, no gloves.Everything is deep fried in oil."
858,I love their fries and their beans.
859,Always a pleasure dealing with him.
860,"They have a plethora of salads and sandwiches, and everything I've tried gets my seal of approval."
861,This place is awesome if you want something light and healthy during the summer.
862,"For sushi on the Strip, this is the place to go."
863,"The service was great, even the manager came and helped with our table."
864,The feel of the dining room was more college cooking course than high class dining and the service was slow at best.
865,"I started this review with two stars, but I'm editing it to give it only one."
866,this is the worst sushi i have ever eat besides Costco's.
867,"All in all an excellent restaurant highlighted by great service, a unique menu, and a beautiful setting."
868,My boyfriend and i sat at the bar and had a completely delightful experience.
869,Weird vibe from owners.
870,There was hardly any meat.
871,I've had better bagels from the grocery store.
872,Go To Place for Gyros.
873,"I love the owner/chef, his one authentic Japanese cool dude!"
874,"Now the burgers aren't as good, the pizza which used to be amazing is doughy and flavorless."
875,I found a six inch long piece of wire in my salsa.
876,"The service was terrible, food was mediocre."
877,We definately enjoyed ourselves.
878,I ordered Albondigas soup - which was just warm - and tasted like tomato soup with frozen meatballs.
879,"On three different occasions I asked for well done or medium well, and all three times I got the bloodiest piece of meat on my plate."
880,I had about two bites and refused to eat anymore.
881,The service was extremely slow.
882,"After 20 minutes wait, I got a table."
883,Seriously killer hot chai latte.
884,"No allergy warnings on the menu, and the waitress had absolutely no clue as to which meals did or did not contain peanuts."
885,My boyfriend tried the Mediterranean Chicken Salad and fell in love.
886,Their rotating beers on tap is also a highlight of this place.
887,Pricing is a bit of a concern at Mellow Mushroom.
888,Worst Thai ever.
889,If you stay in Vegas you must get breakfast here at least once.
890,I want to first say our server was great and we had perfect service.
891,The pizza selections are good.
892,"I had strawberry tea, which was good."
893,Highly unprofessional and rude to a loyal patron!
894,"Overall, a great experience."
895,Spend your money elsewhere.
896,Their regular toasted bread was equally satisfying with the occasional pats of butter... Mmmm...!
897,The Buffet at Bellagio was far from what I anticipated.
898,"And the drinks are WEAK, people!"
899,"Also, I feel like the chips are bought, not made in house."
900,After the disappointing dinner we went elsewhere for dessert.
901,The chips and sals a here is amazing!!!!!!!!!!!!!!!!!!!
902,We won't be returning.
903,This is my new fav Vegas buffet spot.
904,I seriously cannot believe that the owner has so many unexperienced employees that all are running around like chickens with their heads cut off.
905,"Very, very sad."
906,"i felt insulted and disrespected, how could you talk and judge another human being like that?"
907,"How can you call yourself a steakhouse if you can't properly cook a steak, I don't understand!"
908,I'm not impressed with the concept or the food.
909,The only thing I wasn't too crazy about was their guacamole as I don't like it puréed.
910,"There is really nothing for me at postinos, hope your experience is better"
911,I got food poisoning here at the buffet.
912,They brought a fresh batch of fries and I was thinking yay something warm but no!
913,"What SHOULD have been a hilarious, yummy Christmas Eve dinner to remember was the biggest fail of the entire trip for us."
914,"Needless to say, I won't be going back anytime soon."
915,This place is disgusting!
916,"Every time I eat here, I see caring teamwork to a professional degree."
917,The RI style calamari was a joke.
918,"However, there was so much garlic in the fondue, it was barely edible."
919,"I could barely stomach the meal, but didn't complain because it was a business lunch."
920,"It was so bad, I had lost the heart to finish it."
921,It also took her forever to bring us the check when we asked for it.
922,We aren't ones to make a scene at restaurants but I just don't get it...definitely lost the love after this one!
923,Disappointing experience.
924,"The food is about on par with Denny's, which is to say, not good at all."
925,"If you want to wait for mediocre food and downright terrible service, then this is the place for you."
926,WAAAAAAyyyyyyyyyy over rated is all I am saying.
927,We won't be going back.
928,The place was fairly clean but the food simply wasn't worth it.
929,This place lacked style!!
930,"The sangria was about half of a glass wine full and was $12, ridiculous."
931,Don't bother coming here.
932,"The meat was pretty dry, I had the sliced brisket and pulled pork."
933,"The building itself seems pretty neat, the bathroom is pretty trippy, but I wouldn't eat here again."
934,It was equally awful.
935,Probably not in a hurry to go back.
936,very slow at seating even with reservation.
937,Not good by any stretch of the imagination.
938,The cashew cream sauce was bland and the vegetables were undercooked.
939,"The chipolte ranch dipping sause was tasteless, seemed thin and watered down with no heat."
940,"It was a bit too sweet, not really spicy enough, and lacked flavor."
941,I was VERY disappointed!!
942,This place is horrible and way overpriced.
943,"Maybe it's just their Vegetarian fare, but I've been twice and I thought it was average at best."
944,It wasn't busy at all and now we know why.
945,The tables outside are also dirty a lot of the time and the workers are not always friendly and helpful with the menu.
946,"The ambiance here did not feel like a buffet setting, but more of a douchey indoor garden for tea and biscuits."
947,Con: spotty service.
948,"The fries were not hot, and neither was my burger."
949,But then they came back cold.
950,"Then our food came out, disappointment ensued."
951,The real disappointment was our waiter.
952,My husband said she was very rude... did not even apologize for the bad food or anything.
953,The only reason to eat here would be to fill up before a night of binge drinking just to get some carbs in your stomach.
954,"Insults, profound deuchebaggery, and had to go outside for a smoke break while serving just to solidify it."
955,If someone orders two tacos don't' you think it may be part of customer service to ask if it is combo or ala cart?
956,She was quite disappointed although some blame needs to be placed at her door.
957,After all the rave reviews I couldn't wait to eat here......what a disappointment!
958,Del Taco is pretty nasty and should be avoided if possible.
959,It's NOT hard to make a decent hamburger.
960,But I don't like it.
961,Hell no will I go back
962,We've have gotten a much better service from the pizza place next door than the services we received from this restaurant.
963,"I don't know what the big deal is about this place, but I won't be back ""ya'all""."
964,I immediately said I wanted to talk to the manager but I did not want to talk to the guy who was doing shots of fireball behind the bar.
965,The ambiance isn't much better.
966,"Unfortunately, it only set us up for disapppointment with our entrees."
967,The food wasn't good.
968,"Your servers suck, wait, correction, our server Heimer sucked."
969,What happened next was pretty....off putting.
970,"too bad cause I know it's family owned, I really wanted to like this place."
971,Overpriced for what you are getting.
972,I vomited in the bathroom mid lunch.
973,"I kept looking at the time and it had soon become 35 minutes, yet still no food."
974,"I have been to very few places to eat that under no circumstances would I ever return to, and this tops the list."
975,We started with the tuna sashimi which was brownish in color and obviously wasn't fresh.
976,Food was below average.
977,It sure does beat the nachos at the movies but I would expect a little bit more coming from a restaurant.
978,"All in all, Ha Long Bay was a bit of a flop."
979,The problem I have is that they charge $11.99 for a sandwich that is no bigger than a Subway sub (which offers better and more amount of vegetables).
980,Shrimp- When I unwrapped it (I live only 1/2 a mile from Brushfire) it was literally ice cold.
981,"It lacked flavor, seemed undercooked, and dry."
982,It really is impressive that the place hasn't closed down.
983,I would avoid this place if you are staying in the Mirage.
984,The refried beans that came with my meal were dried out and crusty and the food was bland.
985,Spend your money and time some place else.
986,A lady at the table next to us found a live green caterpillar In her salad.
987,the presentation of the food was awful.
988,I can't tell you how disappointed I was.
989,I think food should have flavor and texture and both were lacking.
990,Appetite instantly gone.
991,Overall I was not impressed and would not go back.
992,"The whole experience was underwhelming, and I think we'll just go to Ninja Sushi next time."
993,"Then, as if I hadn't wasted enough of my life there, they poured salt in the wound by drawing out the time it took to bring the check."
