,Review
397,Service is perfect and the family atmosphere is nice to see.
398,Cooked to perfection and the service was impeccable.
399,This one is simply a disappointment.
400,"Overall, I was very disappointed with the quality of food at Bouchon."
401,I don't have to be an accountant to know I'm getting screwed!
402,"Great place to eat, reminds me of the little mom and pop shops in the San Francisco Bay Area."
403,Today was my first taste of a Buldogis Gourmet Hot Dog and I have to tell you it was more than I ever thought possible.
404,Left very frustrated.
405,I'll definitely be in soon again.
406,Food was really good and I got full petty fast.
407,Service was fantastic.
408,TOTAL WASTE OF TIME.
409,I don't know what kind it is but they have the best iced tea.
410,"Come hungry, leave happy and stuffed!"
411,"For service, I give them no stars."
412,I can assure you that you won't be disappointed.
413,I can take a little bad service but the food sucks.
414,Gave up trying to eat any of the crust (teeth still sore).
415,But now I was completely grossed out.
416,I really enjoyed eating here.
417,First time going but I think I will quickly become a regular.
418,"Our server was very nice, and even though he looked a little overwhelmed with all of our needs, he stayed professional and friendly until the end."
419,From what my dinner companions told me...everything was very fresh with nice texture and taste.
420,"On the ground, right next to our table was a large, smeared, been-stepped-in-and-tracked-everywhere pile of green bird poop."
421,"Furthermore, you can't even find hours of operation on the website!"
422,We've tried to like this place but after 10+ times I think we're done with them.
423,What a mistake that was!
424,No complaints!
425,This is some seriously good pizza and I'm an expert/connisseur on the topic.
426,Waiter was a jerk.
427,"Strike 2, who wants to be rushed."
428,These are the nicest restaurant owners I've ever come across.
429,I never come again.
430,We loved the biscuits!!!
431,Service is quick and friendly.
432,Ordered an appetizer and took 40 minutes and then the pizza another 10 minutes.
433,So absolutley fantastic.
434,It was a huge awkward 1.5lb piece of cow that was 3/4ths gristle and fat.
435,definitely will come back here again.
436,I like Steiners because it's dark and it feels like a bar.
437,Wow very spicy but delicious.
438,"If you're not familiar, check it out."
439,I'll take my business dinner dollars elsewhere.
440,I'd love to go back.
441,"Anyway, this FS restaurant has a wonderful breakfast/lunch."
442,Nothing special.
443,Each day of the week they have a different deal and it's all so delicious!
444,"Not to mention the combination of pears, almonds and bacon is a big winner!"
445,Will not be back.
446,Sauce was tasteless.
447,"The food is delicious and just spicy enough, so be sure to ask for spicier if you prefer it that way."
448,My ribeye steak was cooked perfectly and had great mesquite flavor.
449,I don't think we'll be going back anytime soon.
450,Food was so gooodd.
451,I am far from a sushi connoisseur but I can definitely tell the difference between good food and bad food and this was certainly bad food.
452,I was so insulted.
453,The last 3 times I had lunch here has been bad.
454,The chicken wings contained the driest chicken meat I have ever eaten.
455,"The food was very good and I enjoyed every mouthful, an enjoyable relaxed venue for couples small family groups etc."
456,Nargile - I think you are great.
457,Best tater tots in the southwest.
458,We loved the place.
459,Definitely not worth the $3 I paid.
460,The vanilla ice cream was creamy and smooth while the profiterole (choux) pastry was fresh enough.
461,Im in AZ all the time and now have my new spot.
462,The manager was the worst.
463,The inside is really quite nice and very clean.
464,The food was outstanding and the prices were very reasonable.
465,I don't think I'll be running back to Carly's anytime soon for food.
466,"This is was due to the fact that it took 20 minutes to be acknowledged, then another 35 minutes to get our food...and they kept forgetting things."
467,"Love the margaritas, too!"
468,This was my first and only Vegas buffet and it did not disappoint.
469,"Very good, though!"
470,The one down note is the ventilation could use some upgrading.
471,Great pork sandwich.
472,Don't waste your time here.
473,"Total letdown, I would much rather just go to the Camelback Flower Shop and Cartel Coffee."
474,"Third, the cheese on my friend's burger was cold."
475,We enjoy their pizza and brunch.
476,The steaks are all well trimmed and also perfectly cooked.
477,We had a group of 70+ when we claimed we would only have 40 and they handled us beautifully.
478,I LOVED it!
479,We asked for the bill to leave without eating and they didn't bring that either.
480,"This place is a jewel in Las Vegas, and exactly what I've been hoping to find in nearly ten years living here."
481,Seafood was limited to boiled shrimp and crab legs but the crab legs definitely did not taste fresh.
482,The selection of food was not the best.
483,Delicious and I will absolutely be back!
484,"This isn't a small family restaurant, this is a fine dining establishment."
485,They had a toro tartare with a cavier that was extraordinary and I liked the thinly sliced wagyu with white truffle.
486,I dont think I will be back for a very long time.
487,"It was attached to a gas station, and that is rarely a good sign."
488,How awesome is that.
489,I will be back many times soon.
490,The menu had so much good stuff on it i could not decide!
491,"Worse of all, he humiliated his worker right in front of me..Bunch of horrible name callings."
492,CONCLUSION: Very filling meals.
493,Their daily specials are always a hit with my group.
494,And then tragedy struck.
495,The pancake was also really good and pretty large at that.
496,"This was my first crawfish experience, and it was delicious!"
497,Their monster chicken fried steak and eggs is my all time favorite.
498,Waitress was sweet and funny.
499,"I also had to taste my Mom's multi-grain pumpkin pancakes with pecan butter and they were amazing, fluffy, and delicious!"
500,"I'd rather eat airline food, seriously."
501,Cant say enough good things about this place.
502,The ambiance was incredible.
503,The waitress and manager are so friendly.
504,I would not recommend this place.
505,Overall I wasn't very impressed with Noca.
506,My gyro was basically lettuce only.
507,Terrible service!
508,Thoroughly disappointed!
509,"I don't each much pasta, but I love the homemade /hand made pastas and thin pizzas here."
510,"Give it a try, you will be happy you did."
511,By far the BEST cheesecurds we have ever had!
512,Reasonably priced also!
513,Everything was perfect the night we were in.
514,The food is very good for your typical bar food.
515,it was a drive to get there.
516,"At first glance it is a lovely bakery cafe - nice ambiance, clean, friendly staff."
517,"Anyway, I do not think i will go back there."
518,"Point your finger at any item on the menu, order it and you won't be disappointed."
519,"Oh this is such a thing of beauty, this restaurant."
520,If you haven't gone here GO NOW!
521,"A greasy, unhealthy meal."
522,first time there and might just be the last.
523,Those burgers were amazing.
524,"Similarly, the delivery man did not say a word of apology when our food was 45 minutes late."
525,And it was way to expensive.
526,"Be sure to order dessert, even if you need to pack it to-go - the tiramisu and cannoli are both to die for."
527,This was my first time and I can't wait until the next.
528,The bartender was also nice.
529,Everything was good and tasty!
530,This place is two thumbs up....way up.
531,"The best place in Vegas for breakfast (just check out a Sat, or Sun."
532,"If you love authentic Mexican food and want a whole bunch of interesting, yet delicious meats to choose from, you need to try this place."
533,Terrible management.
534,An excellent new restaurant by an experienced Frenchman.
535,If there were zero stars I would give it zero stars.
536,"Great steak, great sides, great wine, amazing desserts."
537,Worst martini ever!
538,The steak and the shrimp are in my opinion the best entrees at GC.
539,I had the opportunity today to sample your amazing pizzas!
540,We waited for thirty minutes to be seated (although there were 8 vacant tables and we were the only folks waiting).
541,The yellowtail carpaccio was melt in your mouth fresh.
542,I won't try going back there even if it's empty.
543,"No, I'm going to eat the potato that I found some strangers hair in it."
544,Just spicy enough.. Perfect actually.
545,Last night was my second time dining here and I was so happy I decided to go back!
546,"not even a ""hello, we will be right with you."""
547,The desserts were a bit strange.
548,My boyfriend and I came here for the first time on a recent trip to Vegas and could not have been more pleased with the quality of food and service.
549,"I really do recommend this place, you can go wrong with this donut place!"
550,Nice ambiance.
551,I would recommend saving room for this!
552,I guess maybe we went on an off night but it was disgraceful.
553,"However, my recent experience at this particular location was not so good."
554,"I know this is not like the other restaurants at all, something is very off here!"
555,AVOID THIS ESTABLISHMENT!
556,I think this restaurant suffers from not trying hard enough.
557,All of the tapas dishes were delicious!
558,I *heart* this place.
559,My salad had a bland vinegrette on the baby greens and hearts of Palm.
560,After two I felt disgusting.
561,A good time!
562,I believe that this place is a great stop for those with a huge belly and hankering for sushi.
563,Generous portions and great taste.
564,I will never go back to this place and will never ever recommended this place to anyone!
565,"The servers went back and forth several times, not even so much as an ""Are you being helped?"""
566,Food was delicious!
567,AN HOUR... seriously?
568,I consider this theft.
569,Eew... This location needs a complete overhaul.
570,We recently witnessed her poor quality of management towards other guests as well.
571,Waited and waited and waited.
572,"He also came back to check on us regularly, excellent service."
573,Our server was super nice and checked on us many times.
574,"The pizza tasted old, super chewy in not a good way."
575,I swung in to give them a try but was deeply disappointed.
576,Service was good and the company was better!
577,The staff are also very friendly and efficient.
578,"As for the service: I'm a fan, because it's quick and you're being served by some nice folks."
579,Boy was that sucker dry!!.
580,Over rated.
581,"If you look for authentic Thai food, go else where."
582,Their steaks are 100% recommended!
583,After I pulled up my car I waited for another 15 minutes before being acknowledged.
584,Great food and great service in a clean and friendly setting.
585,"All in all, I can assure you I'll be back."
586,I hate those things as much as cheap quality black olives.
587,"My breakfast was perpared great, with a beautiful presentation of 3 giant slices of Toast, lightly dusted with powdered sugar."
588,The kids play area is NASTY!
589,Great place fo take out or eat in.
590,The waitress was friendly and happy to accomodate for vegan/veggie options.
591,OMG I felt like I had never eaten Thai food until this dish.
592,"It was extremely ""crumby"" and pretty tasteless."
593,It was a pale color instead of nice and char and has NO flavor.
594,The croutons also taste homemade which is an extra plus.
595,I got home to see the driest damn wings ever!
596,It'll be a regular stop on my trips to Phoenix!
597,I really enjoyed Crema Café before they expanded. I even told friends they had the BEST breakfast.
598,Not good for the money.
599,I miss it and wish they had one in Philadelphia!
600,"We got sitting fairly fast, but, ended up waiting 40 minutes just to place our order, another 30 minutes before the food arrived."
601,They also have the best cheese crisp in town.
602,"Good value, great food, great service."
603,Couldn't ask for a more satisfying meal.
604,The food is good.
605,It was awesome.
606,I just wanted to leave.
607,We made the drive all the way from North Scottsdale... and I was not one bit disappointed!
608,I will not be eating there again.
609,!....THE OWNERS REALLY REALLY need to quit being soooooo cheap let them wrap my freaking sandwich in two papers not one!
610,I checked out this place a couple years ago and was not impressed.
611,"The chicken I got was definitely reheated and was only ok, the wedges were cold and soggy."
612,"Sorry, I will not be getting food from here anytime soon :("
613,An absolute must visit!
614,The cow tongue and cheek tacos are amazing.
615,My friend did not like his Bloody Mary.
616,"Despite how hard I rate businesses, its actually rare for me to give a 1 star."
617,They really want to make your experience a good one.
618,I will not return.
619,I had the chicken Pho and it tasted very bland.
620,Very disappointing!!!
621,The grilled chicken was so tender and yellow from the saffron seasoning.
622,"a drive thru means you do not want to wait around for half an hour for your food, but somehow when we end up going here they make us wait and wait."
623,Pretty awesome place.
624,Ambience is perfect.
625,Best of luck to the rude and non-customer service focused new management.
626,Any grandmother can make a roasted chicken better than this one.
627,I asked multiple times for the wine list and after some time of being ignored I went to the hostess and got one myself.
628,"The staff is always super friendly and helpful, which is especially cool when you bring two small boys and a baby!"
629,Four stars for the food & the guy in the blue shirt for his great vibe & still letting us in to eat !
630,The roast beef sandwich tasted really good!
631,"Same evening, him and I are both drastically sick."
632,High-quality chicken on the chicken Caesar salad.
633,Ordered burger rare came in we'll done.
634,We were promptly greeted and seated.
635,Tried to go here for lunch and it was a madhouse.
636,"I was proven dead wrong by this sushi bar, not only because the quality is great, but the service is fast and the food, impeccable."
637,"After waiting an hour and being seated, I was not in the greatest of moods."
638,This is a good joint.
639,The Macarons here are insanely good.
640,I'm not eating here!
641,"Our waiter was very attentive, friendly, and informative."
642,Maybe if they weren't cold they would have been somewhat edible.
643,This place has a lot of promise but fails to deliver.
644,Very bad Experience!
645,What a mistake.
646,Food was average at best.
647,Great food.
648,We won't be going back anytime soon!
649,Very Very Disappointed ordered the $35 Big Bay Plater.
650,Great place to relax and have an awesome burger and beer.
651,It is PERFECT for a sit-down family meal or get together with a few friends.
652,"Not much flavor to them, and very poorly constructed."
653,The patio seating was very comfortable.
654,The fried rice was dry as well.
655,Hands down my favorite Italian restaurant!
656,"That just SCREAMS ""LEGIT"" in my book...somethat's also pretty rare here in Vegas."
657,It was just not a fun experience.
658,The atmosphere was great with a lovely duo of violinists playing songs we requested.
659,"I personally love the hummus, pita, baklava, falafels and Baba Ganoush (it's amazing what they do with eggplant!)."
660,"Very convenient, since we were staying at the MGM!"
661,The owners are super friendly and the staff is courteous.
662,Both great!
663,Eclectic selection.
664,The sweet potato tots were good but the onion rings were perfection or as close as I have had.
665,The staff was very attentive.
666,And the chef was generous with his time (even came around twice so we can take pictures with him).
667,"The owner used to work at Nobu, so this place is really similar for half the price."
668,Google mediocre and I imagine Smashburger will pop up.
669,dont go here.
670,I promise they won't disappoint.
671,As a sushi lover avoid this place by all means.
672,What a great double cheeseburger!
673,Awesome service and food.
674,A fantastic neighborhood gem !!!
675,I can't wait to go back.
676,The plantains were the worst I've ever tasted.
677,It's a great place and I highly recommend it.
678,Service was slow and not attentive.
679,"I gave it 5 stars then, and I'm giving it 5 stars now."
680,Your staff spends more time talking to themselves than me.
681,Dessert: Panna Cotta was amazing.
682,"Very good food, great atmosphere.1"
683,Damn good steak.
684,Total brunch fail.
685,"Prices are very reasonable, flavors are spot on, the sauce is home made, and the slaw is not drenched in mayo."
686,"The decor is nice, and the piano music soundtrack is pleasant."
687,The steak was amazing...rge fillet relleno was the best seafood plate i have ever had!
688,"Good food , good service ."
689,It was absolutely amazing.
690,"I probably won't be back, to be honest."
691,will definitely be back!
692,The sergeant pepper beef sandwich with auju sauce is an excellent sandwich as well.
693,"Hawaiian Breeze, Mango Magic, and Pineapple Delight are the smoothies that I've tried so far and they're all good."
694,Went for lunch - service was slow.
695,"We had so much to say about the place before we walked in that he expected it to be amazing, but was quickly disappointed."
696,I was mortified.
697,"Needless to say, we will never be back here again."
698,"Anyways, The food was definitely not filling at all, and for the price you pay you should expect more."
699,"The chips that came out were dripping with grease, and mostly not edible."
700,I wasn't really impressed with Strip Steak.
701,Have been going since 2007 and every meal has been awesome!!
702,Our server was very nice and attentive as were the other serving staff.
703,The cashier was friendly and even brought the food out to me.
704,I work in the hospitality industry in Paradise Valley and have refrained from recommending Cibo any longer.
705,The atmosphere here is fun.
706,Would not recommend to others.
707,"Service is quick and even ""to go"" orders are just like we like it!"
708,"I mean really, how do you get so famous for your fish and chips when it's so terrible!?!"
709,"That said, our mouths and bellies were still quite pleased."
710,Not my thing.
711,2 Thumbs Up!!
712,If you are reading this please don't go there.
713,"I loved the grilled pizza, reminded me of legit Italian pizza."
714,Only Pros : Large seating area/ Nice bar area/ Great simple drink menu/ The BEST brick oven pizza with homemade dough!
715,They have a really nice atmosphere.
716,Tonight I had the Elk Filet special...and it sucked.
717,"After one bite, I was hooked."
718,We ordered some old classics and some new dishes after going there a few times and were sorely disappointed with everything.
719,"Cute, quaint, simple, honest."
720,The chicken was deliciously seasoned and had the perfect fry on the outside and moist chicken on the inside.
721,"The food was great as always, compliments to the chef."
722,Special thanks to Dylan T. for the recommendation on what to order :) All yummy for my tummy.
723,Awesome selection of beer.
724,Great food and awesome service!
725,"One nice thing was that they added gratuity on the bill since our party was larger than 6 or 8, and they didn't expect more tip than that."
726,A FLY was in my apple juice.. A FLY!!!!!!!!
727,The Han Nan Chicken was also very tasty.
728,"As for the service, I thought it was good."
729,"The food was barely lukewarm, so it must have been sitting waiting for the server to bring it out to us."
730,Ryan's Bar is definitely one Edinburgh establishment I won't be revisiting.
731,Nicest Chinese restaurant I've been in a while.
732,"Overall, I like there food and the service."
733,They also now serve Indian naan bread with hummus and some spicy pine nut sauce that was out of this world.
734,"Probably never coming back, and wouldn't recommend it."
735,"Friend's pasta -- also bad, he barely touched it."
736,"Try them in the airport to experience some tasty food and speedy, friendly service."
737,I love the decor with the Chinese calligraphy wall paper.
738,Never had anything to complain about here.
739,The restaurant is very clean and has a family restaurant feel to it.
740,It was way over fried.
741,I'm not sure how long we stood there but it was long enough for me to begin to feel awkwardly out of place.
742,"When I opened the sandwich, I was impressed, but not in a good way."
743,Will not be back!
744,There was a warm feeling with the service and I felt like their guest for a special treat.
745,An extensive menu provides lots of options for breakfast.
746,"I always order from the vegetarian menu during dinner, which has a wide array of options to choose from."
747,"I have watched their prices inflate, portions get smaller and management attitudes grow rapidly!"
748,Wonderful lil tapas and the ambience made me feel all warm and fuzzy inside.
749,"I got to enjoy the seafood salad, with a fabulous vinegrette."
750,"The wontons were thin, not thick and chewy, almost melt in your mouth."
751,"Level 5 spicy was perfect, where spice didn't over-whelm the soup."
752,We were sat right on time and our server from the get go was FANTASTIC!
753,"Main thing I didn't enjoy is that the crowd is of older crowd, around mid 30s and up."
754,"When I'm on this side of town, this will definitely be a spot I'll hit up again!"
755,I had to wait over 30 minutes to get my drink and longer to get 2 arepas.
756,This is a GREAT place to eat!
757,The jalapeno bacon is soooo good.
758,The service was poor and thats being nice.
759,"Food was good, service was good, Prices were good."
760,The place was not clean and the food oh so stale!
761,"The chicken dishes are OK, the beef is like shoe leather."
762,But the service was beyond bad.
763,"I'm so happy to be here!!!"""
764,Tasted like dirt.
765,One of the few places in Phoenix that I would definately go back to again .
766,The block was amazing.
767,"It's close to my house, it's low-key, non-fancy, affordable prices, good food."
768,* Both the Hot & Sour & the Egg Flower Soups were absolutely 5 Stars!
769,My sashimi was poor quality being soggy and tasteless.
770,Great time - family dinner on a Sunday night.
771,"the food is not tasty at all, not to say its ""real traditional Hunan style""."
772,"What did bother me, was the slow service."
773,The flair bartenders are absolutely amazing!
774,Their frozen margaritas are WAY too sugary for my taste.
775,These were so good we ordered them twice.
776,So in a nutshell: 1) The restaraunt smells like a combination of a dirty fish market and a sewer.
777,My girlfriend's veal was very bad.
778,"Unfortunately, it was not good."
779,I had a pretty satifying experience.
780,Join the club and get awesome offers via email.
781,"Perfect for someone (me) who only likes beer ice cold, or in this case, even colder."
782,Bland and flavorless is a good way of describing the barely tepid meat.
783,"The chains, which I'm no fan of, beat this place easily."
784,The nachos are a MUST HAVE!
785,We will not be coming back.
786,"I don't have very many words to say about this place, but it does everything pretty well."
787,"The staff is super nice and very quick even with the crazy crowds of the downtown juries, lawyers, and court staff."
788,"Great atmosphere, friendly and fast service."
789,When I received my Pita it was huge it did have a lot of meat in it so thumbs up there.
790,Once your food arrives it's meh.
791,Paying $7.85 for a hot dog and fries that looks like it came out of a kid's meal at the Wienerschnitzel is not my idea of a good meal.
792,The classic Maine Lobster Roll was fantastic.
793,"My brother in law who works at the mall ate here same day, and guess what he was sick all night too."
794,So good I am going to have to review this place twice - once hereas a tribute to the place and once as a tribute to an event held here last night.
795,"The chips and salsa were really good, the salsa was very fresh."
796,This place is great!!!!!!!!!!!!!!
797,Mediocre food.
798,Once you get inside you'll be impressed with the place.
799,I'm super pissd.
800,And service was super friendly.
801,Why are these sad little vegetables so overcooked?
802,This place was such a nice surprise!
803,They were golden-crispy and delicious.
804,"I had high hopes for this place since the burgers are cooked over a charcoal grill, but unfortunately the taste fell flat, way flat."
805,I could eat their bruschetta all day it is devine.
806,Not a single employee came out to see if we were OK or even needed a water refill once they finally served us our food.
807,"Lastly, the mozzarella sticks, they were the best thing we ordered."
808,"The first time I ever came here I had an amazing experience, I still tell people how awesome the duck was."
809,The server was very negligent of our needs and made us feel very unwelcome... I would not suggest this place!
810,The service was terrible though.
811,"This place is overpriced, not consistent with their boba, and it really is OVERPRICED!"
812,It was packed!!
813,I can say that the desserts were yummy.
814,The seasonal fruit was fresh white peach puree.
815,It kept getting worse and worse so now I'm officially done.
816,This place should honestly be blown up.
817,But I definitely would not eat here again.
818,Do not waste your money here!
819,I love that they put their food in nice plastic containers as opposed to cramming it in little paper takeout boxes.
820,The crêpe was delicate and thin and moist.
821,Awful service.
822,Won't ever go here again.
823,Food quality has been horrible.
824,For that price I can think of a few place I would have much rather gone.
